{
  "schemaVersion": 1,
  "catalogVersion": "ci.min",
  "groups": [
    {
      "groupId": "demo",
      "label": "Демо",
      "sortOrder": 0,
      "scope": "global"
    }
  ],
  "attributes": [
    {
      "attributeId": "len",
      "groupId": "demo",
      "name": "Длина",
      "type": "select",
      "sortOrder": 0,
      "parameters": [
        {
          "parameterId": "len-short",
          "label": "Короткое",
          "sortOrder": 0,
          "aliases": ["укороченное"]
        }
      ],
      "allowFreeText": false,
      "allowMultipleDistinct": false
    }
  ]
}
